{
  "task_id": "t-002",
  "plan_id": "plan-poc-001",
  "run_id": "r-step31",
  "capability": "http.load",
  "lane": "gate",
  "intent": "GET /notes chịu 10 VU trong 30s với p95 < 300ms",
  "target": { "kind": "http_service", "base_url": "http://127.0.0.1:8000" },
  "inputs": { "script": "tests/perf/notes_list.js", "vus": 10, "duration": "30s" },
  "oracle": {
    "kind": "threshold",
    "assertions": [
      { "metric": "http_req_duration.p95", "op": "<", "value": 300, "unit": "ms" },
      { "metric": "http_req_failed.rate", "op": "<", "value": 0.01 }
    ]
  },
  "expected_result_kind": "verdict",
  "budget": { "wallclock_s": 90, "tokens": 0, "usd": 0 },
  "determinism": { "seed": null, "replayable": true },
  "sut_identity_ref": "sut-poc",
  "evidence_required": ["raw_output", "stdout"],
  "retry": { "max": 1, "on": ["error"] }
}
