{
  "task_id": "t-001",
  "capability": "api.property",
  "lane": "gate",
  "intent": "GET /notes/{id} và POST /notes: schema conformance + không 5xx (property-based)",
  "target": {
    "kind": "http_service",
    "base_url": "http://127.0.0.1:8000",
    "spec_ref": "http://127.0.0.1:8000/openapi.json"
  },
  "inputs": {
    "schema_url": "http://127.0.0.1:8000/openapi.json",
    "checks": [
      "not_a_server_error",
      "response_schema_conformance"
    ],
    "max_examples": 25,
    "seed": 1337,
    "exclude_path": "/notes/{note_id}/summarize"
  },
  "oracle": {
    "kind": "checks",
    "required": [
      "not_a_server_error",
      "response_schema_conformance"
    ]
  },
  "expected_result_kind": "verdict",
  "budget": {
    "wallclock_s": 120,
    "tokens": 0,
    "usd": 0
  },
  "determinism": {
    "seed": 1337,
    "replayable": true
  },
  "evidence_required": [
    "raw_output",
    "stdout"
  ],
  "retry": {
    "max": 1,
    "on": [
      "error"
    ]
  },
  "plan_id": "plan-f4a3467c",
  "run_id": "r-0004",
  "sut_identity_ref": "sut-f560000f"
}
