{
  "task_id": "t-101", "plan_id": "plan-poc-001", "run_id": "r-0001",
  "capability": "ui.explore", "lane": "discovery",
  "intent": "Khám phá trang /: thêm note, xoá note; tìm trạng thái kẹt hoặc lỗi runtime",
  "target": {"kind": "web_app", "base_url": "http://127.0.0.1:8000", "entry_path": "/"},
  "inputs": {"flow": "midscene/explore_notes.yaml", "max_steps": 15},
  "oracle": {"kind": "implicit_signals",
             "signals": ["console_error", "http_5xx", "dom_unchanged", "element_not_found"],
             "llm_observations_allowed": true},
  "expected_result_kind": "candidate_finding",
  "budget": {"wallclock_s": 600, "tokens": 150000, "usd": 1.0},
  "determinism": {"seed": null, "replayable": false},
  "sut_identity_ref": "sut-poc",
  "evidence_required": ["raw_output"],
  "retry": {"max": 0, "on": []}
}
