{
  "task_id": "t-000",
  "capability": "http.collect",
  "lane": "gate",
  "intent": "Thu thập input/output của API tóm tắt ghi chú qua golden set, làm nguồn cho t-003",
  "target": {
    "kind": "http_service",
    "base_url": "http://127.0.0.1:8000"
  },
  "inputs": {
    "golden": "tests/eval/golden.json"
  },
  "oracle": {
    "kind": "checks",
    "required": [
      "all_http_2xx",
      "count_matches_golden"
    ]
  },
  "expected_result_kind": "verdict",
  "budget": {
    "wallclock_s": 60,
    "tokens": 0,
    "usd": 0
  },
  "determinism": {
    "seed": null,
    "replayable": true
  },
  "evidence_required": [
    "raw_output",
    "stdout"
  ],
  "retry": {
    "max": 1,
    "on": [
      "error"
    ]
  },
  "plan_id": "plan-f4a3467c",
  "run_id": "r-0004",
  "sut_identity_ref": "sut-f560000f"
}
