{
  "task_id": "t-000",
  "plan_id": "plan-poc-001",
  "run_id": "r-collect",
  "capability": "http.collect",
  "lane": "gate",
  "intent": "Thu thập input và output từ API tóm tắt ghi chú",
  "target": {
    "kind": "http_service",
    "base_url": "http://127.0.0.1:8000"
  },
  "inputs": {
    "golden": "tests/eval/golden.json"
  },
  "oracle": {
    "kind": "checks",
    "required": ["all_http_2xx", "count_matches_golden"]
  },
  "expected_result_kind": "verdict",
  "budget": {"wallclock_s": 60, "tokens": 0, "usd": 0},
  "determinism": {"seed": null, "replayable": true},
  "sut_identity_ref": "sut-poc",
  "evidence_required": ["raw_output", "stdout"],
  "retry": {"max": 1, "on": ["error"]}
}
